{
  "schema_version": 1,
  "reviewed_at": "2026-08-27",
  "scope": {
    "levels": ["L0", "L1", "L2"],
    "hosts": ["codex", "claude-code"],
    "supported_environments": ["macos", "windows-wsl2", "linux"]
  },
  "cost_boundary": "The L0-L2 stack avoids mandatory paid extensions, MCP services, and external memory. Access to the selected primary agent is a separate prerequisite and may require an eligible subscription, organizational entitlement, API billing, or cloud-provider account.",
  "profiles": [
    {
      "id": "base",
      "purpose": "Required foundation for a safe, reviewable local research workspace.",
      "component_ids": [
        "primary-agent-access", "primary-agent-client", "isolated-project-workspace",
        "data-boundary-and-backup", "project-control-files", "local-git", "local-file-search",
        "permission-baseline", "source-verification", "change-review", "evidence-lab-foundation",
        "research-records", "installation-state-and-recovery"
      ]
    },
    {
      "id": "documents",
      "purpose": "Adds local extraction, OCR, conversion, publishing, and bibliography tools when the research materials require them.",
      "component_ids": ["pdf-text-extraction", "scanned-pdf-ocr", "document-conversion", "reproducible-publishing", "zotero-bibliography"]
    },
    {
      "id": "data",
      "purpose": "Adds a reproducible Python notebook environment; R remains a discipline-specific branch.",
      "component_ids": ["python-data-environment", "r-data-environment"]
    }
  ],
  "components": [
    {
      "id": "primary-agent-access",
      "level": "L0",
      "title": "Primary agent account and access",
      "category": "access",
      "inclusion": "route-required",
      "hosts": ["codex", "claude-code"],
      "maturity": "core",
      "access_cost": {
        "class": "provider-access-required",
        "note": "Choose one provider route. Provider access is not counted as a free Evidence Lab extension."
      },
      "license": {
        "value": "Provider terms",
        "evidence": "https://learn.chatgpt.com/docs/codex/cli"
      },
      "data": {
        "scope": "Prompts and the project context selected for an agent task.",
        "leaves_device": "provider-dependent",
        "destination": "Selected AI provider or approved cloud provider"
      },
      "system_requirements": ["Supported provider region and an eligible account route"],
      "lifecycle": {
        "install": "Create or use an approved personal or organizational account for one primary host.",
        "verify": "Start the host and confirm the active account and billing route without exposing credentials.",
        "update": "Review entitlement, billing route, and organizational policy when the provider terms change.",
        "remove": "Sign out, revoke the local session, and remove the account connection under the provider policy."
      },
      "verification": {
        "status": "docs-verified",
        "evidence_refs": ["https://learn.chatgpt.com/docs/codex/cli", "https://code.claude.com/docs/en/authentication"],
        "limitations": "Pricing and data controls depend on the selected account and must be checked at consultation time."
      }
    },
    {
      "id": "primary-agent-client",
      "level": "L0",
      "title": "Codex or Claude Code client",
      "category": "access",
      "inclusion": "route-required",
      "hosts": ["codex", "claude-code"],
      "maturity": "core",
      "access_cost": {
        "class": "no-extra-charge",
        "note": "The client has no separate Evidence Lab charge; provider access remains a separate prerequisite."
      },
      "license": {
        "value": "Host-specific distribution terms",
        "evidence": "https://learn.chatgpt.com/docs/codex/cli"
      },
      "data": {
        "scope": "Files opened by the client, commands, prompts, results, and local configuration.",
        "leaves_device": "provider-dependent",
        "destination": "Local machine and selected AI provider"
      },
      "system_requirements": ["macOS, supported Linux, or Windows through the supported host route", "Internet access for authentication and model use"],
      "lifecycle": {
        "install": "Codex: run the official standalone installer. Claude Code: use the current native installer documented by Anthropic.",
        "verify": "Run `codex --version` or `claude --version`, then complete one read-only task in a test folder.",
        "update": "Codex: rerun the official installer. Claude Code: use automatic updates or `claude update`.",
        "remove": "Use the host's documented uninstall route, then inspect and remove only host-owned configuration after exporting required settings."
      },
      "verification": {
        "status": "locally-observed",
        "evidence_refs": ["tests/evidence/l0-l2-linux-2026-08-27.json", "https://learn.chatgpt.com/docs/codex/cli", "https://code.claude.com/docs/en/setup"],
        "limitations": "Both clients were observed on Linux; clean install and removal still need macOS and WSL2 runs."
      }
    },
    {
      "id": "isolated-project-workspace",
      "level": "L0",
      "title": "Isolated project workspace",
      "category": "workspace",
      "inclusion": "required",
      "hosts": ["shared"],
      "maturity": "core",
      "access_cost": {"class": "no-extra-charge", "note": "Uses a dedicated local folder and existing approved storage."},
      "license": {"value": "Not applicable", "evidence": "https://github.com/timsmykov/evidence-lab-plugins/blob/main/docs/l0-l2-technical-stack.md"},
      "data": {
        "scope": "Source files, notes, data, outputs, and checks for one research project.",
        "leaves_device": "only-on-explicit-network-use",
        "destination": "Local project folder and explicitly approved backup"
      },
      "system_requirements": ["Writable project directory", "Sufficient storage for source files and generated outputs"],
      "lifecycle": {
        "install": "Create one project folder with separate source, data, note, output, and check areas.",
        "verify": "Confirm the agent can read the folder and create one disposable test artifact only after approval.",
        "update": "Add folders through reviewed project instructions; preserve existing source paths.",
        "remove": "Export required outputs, then archive or delete the project folder under the researcher's retention policy."
      },
      "verification": {
        "status": "docs-verified",
        "evidence_refs": ["BOOTSTRAP.md", "docs/architecture.md"],
        "limitations": "Backup provider and retention rules are client-specific."
      }
    },
    {
      "id": "data-boundary-and-backup",
      "level": "L0",
      "title": "Data boundary, backup, and secret handling",
      "category": "policy",
      "inclusion": "required",
      "hosts": ["shared"],
      "maturity": "core",
      "access_cost": {"class": "varies", "note": "Uses the client's approved backup and password-management services; Evidence Lab adds no service requirement."},
      "license": {"value": "Client policy and selected service terms", "evidence": "https://github.com/timsmykov/evidence-lab-plugins/blob/main/SECURITY.md"},
      "data": {
        "scope": "Project data classification, backup copies, credentials, and excluded locations.",
        "leaves_device": "provider-dependent",
        "destination": "Only client-approved storage and secret-management systems"
      },
      "system_requirements": ["Written data classification", "Approved backup target", "Existing password or secret manager"],
      "lifecycle": {
        "install": "Record allowed data classes, excluded folders, backup destination, and credential-handling rule.",
        "verify": "Restore one harmless test file and confirm secrets are absent from the project and agent transcript.",
        "update": "Review the boundary when sources, collaborators, or provider settings change.",
        "remove": "Revoke project credentials and apply the client's retention and deletion policy to backups."
      },
      "verification": {
        "status": "docs-verified",
        "evidence_refs": ["SECURITY.md", "docs/sanitization-policy.md"],
        "limitations": "Evidence Lab cannot certify a client's organizational backup or retention implementation."
      }
    },
    {
      "id": "project-control-files",
      "level": "L1",
      "title": "Portable project instructions and structure",
      "category": "workspace",
      "inclusion": "required",
      "hosts": ["shared", "codex", "claude-code"],
      "maturity": "core",
      "access_cost": {"class": "no-extra-charge", "note": "Plain Markdown and JSON files stored with the project."},
      "license": {"value": "Client-owned content; Evidence Lab templates follow repository terms", "evidence": "https://github.com/timsmykov/evidence-lab-plugins/blob/main/LICENSE"},
      "data": {
        "scope": "Project purpose, constraints, folder map, acceptance checks, and non-secret operating rules.",
        "leaves_device": "only-on-explicit-network-use",
        "destination": "Project repository and the active agent context"
      },
      "system_requirements": ["Text editor or agent file access", "Project folder from L0"],
      "lifecycle": {
        "install": "Create `AGENTS.md`, a Claude adapter when needed, `README.md`, decision log, acceptance checklist, and standard folders.",
        "verify": "Ask each host to state the project boundary and complete a small task under the same acceptance rule.",
        "update": "Review changes through Git and keep shared rules in `AGENTS.md` rather than duplicating them by host.",
        "remove": "Remove the template files only after exporting project-specific rules that must be retained."
      },
      "verification": {
        "status": "simulated-cross-host",
        "evidence_refs": ["scripts/test_agent_first.py", "docs/architecture.md"],